Budget Item Code,Georgian Name,Budget Item Type,English Translation
38 00,საქართველოს გარემოსა და ბუნებრივი რესურსების დაცვის სამინისტრო,SpendingAgency,Ministry of Environment and Natural Resources Protection of Georgia
38 00,საქართველოს გარემოს დაცვის სამინისტრო,SpendingAgency,Ministry Of Environment
38 01,გარემოს დაცვის სფეროში პოლიტიკის შემუშავება რეგულირება და მართვა,Program,"Policy Making, Regulation And Management In Protection Of Environment"
38 01,"გარემოს დაცვის სფეროში პოლიტიკის შემუშავება, რეგულირება და მართვა",Program,"Policy Making, Regulation And Management In Protection Of Environment"
38 02,დაცული ტერიტორიების სისტემის ჩამოყალიბება და მართვა,Program,Establishment And Management Of Protected Areas 
38 02,გარემოსდაცვითი ზედამხედველობა,Program,Environmental Supervision
38 03,გარემოს დაცვის სფეროში მონიტორინგი პროგნოზირება და პრევენცია,Program,"Monitoring, Projections And Prevention In The Environment"
38 03,დაცული ტერიტორიების სისტემის ჩამოყალიბება და მართვა,Program,Formation and Management Of Protected Area System
38 03,გარემოს დაცვის სფეროში მონიტორინგი პროგნოზირება და პრევენცია,Program,"Monitoring, Projections And Prevention In The Environment"
38 03,"გარემოს დაცვის სფეროში მონიტორინგი, პროგნოზირება და პრევენცია",Program,"Monitoring, Projections And Prevention In The Environment"
38 04,სატყეო სისტემის ჩამოყალიბება და მართვა,Program,Creation And Management Of Forestry System
38 04,სატყეო სისტემის ჩამოყალიბება და მართვა,Program,Creation And Management Of Forestry System
38 05,სანერგე მეურნეობის სისტემის ჩამოყალიბება და მართვა,Program,Creation and Management of Sapling Forestry System
38 05,სანერგე მეურნეობის სისტემის ჩამოყალიბება და მართვა,Program,Creation and Management of Sapling Forestry System
38 05,ეროვნული სანაშენე მეურნეობის სისტემის ჩამოყალიბება და მართვა,Program,Creation and Management of National Sapling Forestry System
38 06,გარემოსდაცვით ინფორმაციაზე ხელმისაწვდომობისა და გარემოსდაცვითი განათლების ხელშეწყობის პროგრამა,Program,Access to Environmental Information And Environmental Education Promotion Program
38 06,გარემოსდაცვითი ინფორმაციის ხელმისაწვდომობისა და გარემოსდაცვითი განათლების ხელშეწყობის პროგრამა,Program,Access to Environmental Information And Environmental Education Promotion Program
38 06,გარემოსდაცვით ინფორმაციაზე ხელმისაწვდომობისა და გარემოსდაცვითი განათლების ხელშეწყობის პროგრამა,Program,Access to Environmental Information And Environmental Education Promotion Program
38 07,"გარემოს დაცვის სფეროში მონიტორინგი, პროგნოზირება და პრევენცია",Program,"Monitoring, Forecasting And Prevention In Environmental Field"
38 07,ბირთვული და რადიაციული უსაფრთხოების დაცვა,Program,Protection Of Nuclear And Radiation Safety
38 08,"გარემოს დაცვის სფეროში მონიტორინგი, პროგნოზირება, პრევენცია და ბუნებრივი რესურსების მართვა",Program,"Monitoring, Prediction, Prevention And Management Of Natural Resources In The Environmental Field"
39 00,საქართველოს სპორტისა და ახალგაზრდობის საქმეთა სამინისტრო,SpendingAgency,Ministry of Sport and Youth Affairs of Georgia
39 01,სპორტისა და ახალგაზრდობის საქმეთა სფეროების სახელმწიფო პოლიტიკის შემუშავება და მართვა,Program,State Policy Making And Program Management In The Sports And Youth Affairs
39 01,სპორტისა და ახალგაზრდობის საქმეთა სფეროებში სახელმწიფო პოლიტიკის შემუშავება და მართვა,Program,State Policy Making And Program Management In The Sports And Youth Affairs
39 02,სპორტის განვითარების ხელშეწყობის ღონისძიებები,Program,Measures To Support The Sport Development
39 03,სპორტის სფეროში დამსახურებულ მოღვაწეთა სოციალური დაცვის ღონისძიებები,Program,Social Protection Measures For Celebrity Sportsmen
39 04,ახალგაზრდობის სფეროში სახელმწიფო ხელშეწყობის ღონისძიებები,Program,State Stimulation Measures In The Youth Affairs
40 00,საქართველოს სახელმწიფო დაცვის სპეციალური სამსახური,SpendingAgency,Special Security Service Of Georgia
40 00,საქართველოს სახელმწიფო დაცვის სპეციალური სამსახური,SpendingAgency,Special Security Service Of Georgia
40 01,დასაცავ პირთა და ობიექტთა უსაფრთხოების უზრუნველყოფა,Program,Protection the security of persons and objects
40 02,სახელმწიფო ობიექტების მოვლა-შენახვა,Program,Maintenance Of State Facilities
41 00,საქართველოს სახალხო დამცველის აპარატი,SpendingAgency,Public Defender’s Office Of Georgia
41 01,საქართველოს სახალხო დამცველის აპარატის ფუნქციონირების გაძლიერების ღონისძიებები (საქართველოს სახალხო დამცველის აპარატი,Program,Measures To Strengthen The Functioning Of The Public Defender's Office (Public Defender Office)
41 01,საქართველოს სახალხო დამცველის აპარატის ფუნქციონირების გაძლიერების ღონისძიებები საქართველოს სახალხო დამცველის აპარატი,Program,Measures to strengthen the functioning of the Public Defender's Office (Public Defender Office)
42 00,სსიპ – საზოგადოებრივი მაუწყებელი,SpendingAgency,LEPL – Public Broadcaster
42 00,სსიპ - საზოგადოებრივი მაუწყებელი,SpendingAgency,LEPL – Public Broadcaster
42 01,მაუწყებლობის ხელშეწყობა,Program,Promotion Of Broadcasting
43 00,სსიპ – კონკურენციისა და სახელმწიფო შესყიდვების სააგენტო,SpendingAgency,LEPL – Competition And Public Procurement Agency 
43 00,სსიპ - კონკურენციის სააგენტო,SpendingAgency,LEPL – Competition Agency
43 01,სსიპ კონკურენციისა და სახელმწიფო შესყიდვების სააგენტო,Program,LEPL – Competition And Public Procurement Agency 
43 01,სსიპ - კონკურენციისა და სახელმწიფო შესყიდვების სააგენტო,Program,LEPL – Competition And Public Procurement Agency 
43 02,სახელმწიფო სექტორის ფინანსური მართვის მხარდაჭერის პროექტი (WB–SIDA–ნიდერლანდი– DFID),Program,Public Sector Financial Management Support Project (WB-SIDA- Netherlands-DFID)
43 02,სახელმწიფო სექტორის ფინანსური მართვის მხარდაჭერის პროექტი (WB-SIDA-ნიდერლანდი- DFID),Program,Public Sector Financial Management Support Project (WB-SIDA- Netherlands-DFID)
43 02,სახელმწიფო სექტორის ფინანსური მართვის მხარდაჭერის პროექტი (WB-SIDA-ნიდერლანდი-DFID),Program,Public Sector Financial Management Support Project (WB-SIDA- Netherlands-DFID)
44 00,სამხრეთ ოსეთის ადმინისტრაცია,SpendingAgency,Administration Of South Ossetia
44 00,ყოფილი სამხრეთ ოსეთის ავტონომიური ოლქის ტერიტორიაზე დროებითი ადმინისტრაციულ-ტერიტორიული ერთეულის ადმინისტრაცია - სამხრეთ ოსეთის ადმინისტრაცია,SpendingAgency,Provisional Administrative-Territorial Entity Administration At The Former South Ossetian Autonomous District-Administration Of South Ossetia
44 00,ყოფილი სამხრეთ ოსეთის ავტონომიური ოლქის ტერიტორიაზე დროებითი ადმინისტრაციულ-ტერიტორიული ერთეულის ადმინისტრაცია – სამხრეთ ოსეთის ადმინისტრაცია,SpendingAgency,Provisional Administrative-Territorial Entity Administration At The Former South Ossetian Autonomous District-Administration Of South Ossetia
45 00,საქართველოს საპატრიარქო,SpendingAgency,Patriarchy Of Georgia
45 01,სასულიერო განათლების ხელშეწყობის გრანტი,Program,Theological Education Assistance Grant
45 01,სასულიერო განათლების და ხელშეწყობის გრანტი,Program,Grant For Theological Education And Assistance
45 02,ა(ა)იპ საქართველოს საპატრიარქოს წმიდა სვიმონ კანანელის სახელობის სასულიერო სწავლების ცენტრი,Program,NNLP Theological Teaching Centre of St. Svimon Kananeli Church
45 02,საქართველოს საპატრიარქოს წმინდა სიმონ კანანელის სახელობის სასულიერო სწავლების ცენტრისათვის გადასაცემი გრანტი,Program,Grant For Theological Teaching Centre of St. Svimon Kananeli Church
45 02,ა ა იპ საქართველოს საპატრიარქოს წმიდა სვიმონ კანანელის სახელობის სასულიერო სწავლების ცენტრი,Program,Grant For NNLP Theological Teaching Centre of St. Svimon Kananeli Church
45 02,ა(ა)იპ – საქართველოს საპატრიარქოს წმიდა სვიმონ კანანელის სახელობის სასულიერო სწავლების ცენტრი,Program,Grant For NNLP Theological Teaching Centre of St. Svimon Kananeli Church
45 03,ა ა იპ – ბათუმისა და ლაზეთის ეპარქიის საგანმანათლებლო ცენტრისათვის გადასაცემი გრანტი,Program,NNLP - Grant For Educational Centre for Diocese of Batumi And Lazeti 
45 03,ა ა იპ - ბათუმისა და ლაზეთის ეპარქიის საგანმანათლებლო ცენტრისათვის გადასაცემი გრანტი,Program,NNLP - Grant For Educational Centre for Diocese of Batumi And Lazeti 
45 03,ა(ა)იპ - ბათუმისა და ლაზეთის ეპარქიის საგანმანათლებლო ცენტრისათვის გადასაცემი გრანტი,Program,NNLP - Grant For Educational Centre for Diocese of Batumi And Lazeti 
45 04,"საქართველოს საპატრიარქოს წმიდა ნინოს სახელობის ობოლ, უპატრონო და მზრუნველობამოკლებულ ბავშვთა პანსიონატისათვის გადასაცემი გრანტი",Program,"Grant For St. Nino's Orphaned, Abandoned And Homeless Children's Boarding House"
45 04,საქართველოს საპატრიარქოს წმიდა ნინოს სახელობის ობოლ უპატრონო და მზრუნველობამოკლებულ ბავშვთა პანსიონატისათვის გადასაცემი გრანტი,Program,"Grant For St. Nino's Orphaned, Abandoned And Homeless Children's Boarding House"
45 05,საქართველოს საპატრიარქოს ბათუმის წმინდა მოწამე ეკატერინეს სახელობის სათნოების სავანისათვის გადასაცემი გრანტი,Program,Grant For Patriarchate of Georgia Batumi Saint Catherine's Monastery
45 05,საქართველოს საპატრიარქოს ბათუმის წმიდა მოწამე ეკატერინეს სახელობის სათნოების სავანისათვის გადასაცემი გრანტი,Program,Grant For Patriarchate of Georgia Batumi Saint Catherine's Monastery
45 06,საქართველოს საპატრიარქოს წმინდა ანდრია პირველწოდებულის სახელობის სასულიერო სწავლების ცენტრისათვის გადასაცემი გრანტი,Program,Grant for St. Andrew First-Called Theological Training Centre
45 06,საქართველოს საპატრიარქოს წმიდა ანდრია პირველწოდებულის სახელობის სასულიერო სწავლების ცენტრისათვის გადასაცემი გრანტი,Program,Grant for St. Andrew First-Called Theological Training Centre
45 07,წმინდა გიორგი მთაწმინდელის მონასტერთან არსებული სარეაბილიტაციო ცენტრისათვის გადასაცემი გრანტი,Program,Grant for Rehabilitation Centre existing In  St. George Monastery
45 08,საქართველოს საპატრიარქოს წმინდა ანდრია პირველწოდებულის სახელობის ქართული უნივერსიტეტისათვის გადასაცემი გრანტი,Program,Grant for St. Andrew First-Called Georgian University
45 08,საქართველოს საპატრიარქოს წმიდა ანდრია პირველწოდებულის სახელობის ქართული უნივერსიტეტისათვის გადასაცემი გრანტი,Program,Grant for St. Andrew First-Called Georgian University
45 09,საქართველოს საპატრიარქოს ა ა იპ – ტბელ აბუსერისძის სახელობის უნივერსიტეტისათვის გადასაცემი გრანტი,Program,Grant for Georgian Patriarchate NNLP Tbel Abuseridze University
45 09,საქართველოს საპატრიარქოს ა ა იპ - ტბელ აბუსერისძის სახელობის უნივერსიტეტისათვის გადასაცემი გრანტი,Program,Grant for Georgian Patriarchate NNLP Tbel Abuseridze University
45 09,საქართველოს საპატრიარქოს ა(ა)იპ - ტბელ აბუსერისძის სახელობის უნივერსიტეტისათვის გადასაცემი გრანტი,Program,Grant for Georgian Patriarchate NNLP Tbel Abuseridze University
45 09,ა(ა)იპ – საქართველოს საპატრიარქოს ტბელ აბუსერისძის სახელობის უნივერსიტეტისათვის გადასაცემი გრანტი,Program,Grant for Georgian Patriarchate NNLP Tbel Abuseridze University
45 10,ა ა იპ – სმენადაქვეითებულ ბავშვთა რეაბილიტაციის და ადაპტაციის ცენტრისათვის გადასაცემი გრანტი,Program,Grant For NNLP Rehabilitation And Adaptation Centre For Children With Hear Impairment
45 10,ა ა იპ - სმენადაქვეითებულ ბავშვთა რეაბილიტაციის და ადაპტაციის ცენტრისათვის გადასაცემი გრანტი,Program,Grant For NNLP Rehabilitation And Adaptation Centre For Children With Hear Impairment
45 10,ა(ა)იპ - სმენადაქვეითებულ ბავშვთა რეაბილიტაციის და ადაპტაციის ცენტრისათვის გადასაცემი გრანტი,Program,Grant For NNLP Rehabilitation And Adaptation Centre For Children With Hear Impairment
45 10,ა(ა)იპ – სმენადაქვეითებულ ბავშვთა რეაბილიტაციისა და ადაპტაციის ცენტრისათვის გადასაცემი გრანტი,Program,Grant For NNLP Rehabilitation And Adaptation Centre For Children With Hear Impairment
45 11,საქართველოს საპატრიარქოს ტელევიზიის სუბსიდირების ღონისძიებები,Program,Subsidy Measures for Georgian Patriarchate's TV
45 12,ა(ა)იპ – ახალქალაქისა და კუმურდოს ეპარქიის სასწავლო ცენტრისთვის გადასაცემი გრანტი,Program,Grant for NNLP Akhalkalaki and Kumurdo Diocese Center
45 12,ა ა იპ - ახალქალაქისა და კუმურდოს ეპარქიის სასწავლო ცენტრისთვის გადასაცემი გრანტი,Program,Grant for NNLP Training Centre in Akhalkalaki And Kumurdo
45 12,ა ა იპ – ახალქალაქისა და კუმურდოს ეპარქიის სასწავლო ცენტრისთვის გადასაცემი გრანტი,Program,Grant for NNLP Training Centre in Akhalkalaki And Kumurdo
45 12,ა(ა)იპ - ახალქალაქისა და კუმურდოს ეპარქიის სასწავლო ცენტრისთვის გადასაცემი გრანტი,Program,Grant for NNLP Akhalkalaki and Kumurdo Diocese Center
45 12,ა(ა)იპ – ახალქალაქისა და კუმურდოს ეპარქიის სასწავლო ცენტრისათვის გადასაცემი გრანტი,Program,Grant for NNLP Akhalkalaki and Kumurdo Diocese Center
45 13,ა(ა)იპ ფოთის საგანმანათლებლო და კულტურულ-გამაჯანსაღებელი ცენტრი,Program,NNLP Poti Educational And Cultural Center
45 13,ა ა იპ ფოთის საგანმანათლებლო და კულტურულ გამაჯანსაღებელი ცენტრი,Program,NNLP Poti Educational And Cultural Center
45 13,ა(ა)იპ – ფოთის საგანმანათლებლო და კულტურულ-გამაჯანსაღებელი ცენტრი,Program,NNLP Poti Educational And Cultural Center
45 13,ა(ა)იპ − ფოთის საგანმანათლებლო და კულტურულ-გამაჯანსაღებელი ცენტრი,Program,NNLP Poti Educational And Cultural Center
46 00,სსიპ – ლევან სამხარაულის სახელობის სასამართლო ექსპერტიზის ეროვნული ბიურო,SpendingAgency,LEPL – National Forensics Bureau Named After Levan Samkharauli
46 00,სსიპ – ლევან სამხარაულის სახელობის სასამართლო ექსპერტიზის ეროვნული ბიურო,SpendingAgency,LEPL – National Forensics Bureau Named After Levan Samkharauli
46 00,სსიპ - ლევან სამხარაულის სახელობის სასამართლო ექსპერტიზის ეროვნული ბიურო,SpendingAgency,LEPL – National Forensics Bureau Named After Levan Samkharauli
47 00,სსიპ – საქართველოს სტატისტიკის ეროვნული სამსახური – საქსტატი,Spending Agency,LEPL - National Statistic Office of Georgia - Geostat
47 00,სსიპ - საქართველოს სტატისტიკის ეროვნული სამსახური - საქსტატი,SpendingAgency,LEPL - National Statistic Office of Georgia - Geostat
47 01,სტატისტიკური სამუშაოების დაგეგმვა და მართვა,Program,Planning And Management Of Statistics 
47 02,სტატისტიკური სამუშაოების სახელმწიფო პროგრამა,Program,State Program Of Statistics
47 03,მოსახლეობისა და საცხოვრისების საყოველთაო აღწერა,Program,General Census And Household Studies
47 04,შინამეურნეობების ინტეგრირებული კვლევის პროგრამა,Program,Integrated Household Survey Program
47 05,სასოფლო მეურნეობების შერჩევითი კვლევის პროგრამა,Program,Random Selection Study Program Of Agriculture
