Budget Item Code,Georgian Name,Budget Item Type,English Translation
26 01,"სამართალშემოქმედებისა და ქვეყნის ინტერესების სამართლებრივი მხარდაჭერის მიზნით სახელმწიფო პოლიტიკის შემუშავება და მართვა, მათ შორის, სისხლის სამართლის სისტემის რეფორმის განხორციელება",Program,"State Policy Making And Management For Legislative Operation And For Protection Of Country’s Interests, Also, Implementation Of Criminal Justice System Reform"
26 01,სამართალშემოქმედებისა და ქვეყნის ინტერესების სამართლებრივი მხარდაჭერის მიზნით სახელმწიფო პოლიტიკის შემუშავება და მართვა მათ შორის სისხლის სამართლის სისტემის რეფორმის განხორციელება,Program,"State Policy Making And Management For Legislative Operation And For Protection Of Country’s Interests, Also, Implementation Of Criminal Justice System Reform"
26 02,გამოძიებაზე ზედამხედველობის სახელმწიფო ბრალდების მხარდაჭერის დანაშაულის წინააღმდეგ ბრძოლისა და პრევენციის პროგრამა,Program,"Supervision On Investigation, Public Prosecution Support, Crime Fight And Prevention Program"
26 02,"გამოძიებაზე ზედამხედველობის, სახელმწიფო ბრალდების მხარდაჭერის, დანაშაულის წინააღმდეგ ბრძოლისა და პრევენციის პროგრამა",Program,"Supervision On Investigation, Public Prosecution Support, Crime Fight And Prevention Program"
26 03,ეროვნული საარქივო ფონდის დაცულობის მომსახურების თანამედროვე ტექნოლოგიების დანერგვის და დოკუმენტების ხელმისაწვდომობის უზრუნველყოფა,Program,"Protection Of National Archive Fund, Introduction Of Modern Technologies Of Services And Ensured Access To Documents"
26 03,"ეროვნული საარქივო ფონდის დაცულობის, მომსახურების თანამედროვე ტექნოლოგიების დანერგვის და დოკუმენტების ხელმისაწვდომობის უზრუნველყოფა",Program,"Protection Of National Archive Fund, Introduction Of Modern Technologies Of Services And Ensured Access To Documents"
26 03,"ეროვნული საარქივო ფონდის დაცულობის, მომსახურების თანამედროვე ტექნოლოგიების დანერგვისა და დოკუმენტების ხელმისაწვდომობის უზრუნველყოფა",Program,"Protection Of National Archive Fund, Introduction Of Modern Technologies Of Services And Ensured Access To Documents"
26 04,იუსტიციის სამინისტროს სისტემის თანამშრომელთა გადამზადება და სასწავლო ცენტრის განვითარება,Program,Staff Retraining In The System Of The Ministry Of Justice And Development Of Training Centre
26 04,საქართველოს იუსტიციის სამინისტროს სისტემის თანამშრომელთა გადამზადება და სასწავლო ცენტრის განვითარება,Program,Staff Retraining In The System Of The Ministry Of Justice Of Georgia And Development Of Training Centre
26 05,ელექტრონული მმართველობის განვითარება,Program,Development Of E-Governance
26 06,იუსტიციის სახლების ფარგლებში მომსახურებათა ეფექტიანი წარმოება და ყველა დაინტერესებული პირისათვის ხელმისაწვდომობა,Program,Efficient Operation Of Services At Houses Of Justice And Affordability Of All Interested Individuals
26 08,ერთიანი სახელმწიფო საინფორმაციო ტექნოლოგიების მხარდაჭერის განვითარება,Program,Support The Development Of Informational Technologies
26 08,ერთიანი სახელმწიფო საინფორმაციო ტექნოლოგიების მხარდაჭერის განვითარება,Program,Support The Development Of Informational Technologies
26 08,სახელმწიფო სერვისების განვითარების სააგენტოს მომსახურებათა განვითარება და ხელმისაწვდომობა,Program,Development and Availability To Public Service Development Agency Services
26 08,დანაშაულის პრევენცია და ინოვაციური პროგრამები,Program,Crime Prevention And Innovative Programs
26 09,ტურისტული საინვესტიციო და ინფრასტრუქტურული პროექტების კოორდინაცია და მონიტორინგი,Program,Coordinate And Monitor Tourism Investment and Infrastructure Projects
26 09,იუსტიციის სახლის მომსახურებათა განვითარება და ხელმისაწვდომობა,Program,Development And Accessibility To Services In Public Service Hall 
26 09,მიწის ბაზრის განვითარება (WB),Program,Land Market Development (WB)
26 10,იუსტიციის სახლის მომსახურებათა განვითარება და ხელმისაწვდომობა,Program,Development and Accessibility To Public Service Hall Services 
26 10,ნორმატიული აქტების სისტემატიზაცია და მთარგმნელობითი ცენტრის განვითარება,Program,Systematization Of Normative Acts And Development Of Translation Centre
26 11,"ტურისტული, საინვესტიციო და ინფრასტრუქტურული პროექტების კოორდინაცია და მონიტორინგი",Program,"Coordinating And Monitoring Of Tourism, Investment And Infrastructural Projects"
26 12,საჯარო რეესტრის ეროვნული სააგენტოს მომსახურებათა განვითარება და ხელმისაწვდომობა,Program,Development And Availability Of Services Of National Agency of Public Registry
27 00,საქართველოს სასჯელაღსრულების პრობაციისა და იურიდიული დახმარების საკითხთა სამინისტრო,SpendingAgency,Ministry Of Corrections And Legal Assistance of Georgia
27 00,"საქართველოს სასჯელაღსრულების, პრობაციისა და იურიდიული დახმარების საკითხთა სამინისტრო",SpendingAgency,Ministry Of Corrections And Legal Assistance of Georgia
27 00,საქართველოს სასჯელაღსრულებისა და პრობაციის სამინისტრო,SpendingAgency,Ministry of Corrections of Georgia
27 01,პენიტენციური სისტემის პოლიტიკის შემუშავება და მართვა,Program,Policy Making And Management For Penitentiary System
27 01,პენიტენციარული სისტემის პოლიტიკის შემუშავება და მართვა,Program,Policy Making And Management For Penitentiary System
27 01 01,"პენიტენციური სისტემის პოლიტიკის შემუშავება, მართვა და ბრალდებულ/მსჯავრდებულთა ყოფითი პირობების გაუმჯობესება",Program,"Penitentiary policy development, management, and improving life conditions for accused and condemned"
27 01 01,"პენიტენციური სისტემის პოლიტიკის შემუშავება, მართვა და ბრალდებულთა/მსჯავრდებულთა ყოფითი პირობების გაუმჯობესება",Program,"Penitentiary policy development, management, and improving life conditions for accused and condemned"
27 01 03,პენიტენციური სისტემის ინფრასტრუქტურის გაუმჯობესება,Program,Improving The Infrastructure Of The Penitentiary System
27 02,სისხლის სამართლის სისტემის რეფორმა,Program,Criminal Justice Reform
27 02,სრულყოფილი პრობაციის სისტემა,Program,Comprehensive Probation System
27 02 01,საერთაშორისო სტანდარტების შესაბამისი პენიტენციური სისტემის ჩამოყალიბება,Program,Establishment Of Penitentiary System With International Standards
27 02 01,საერთაშორისო სტანდარტების შესაბამისი პენიტენციური სისტემის ჩამოყალიბება,Program,Establishment Of Penitentiary System With International Standards
27 02 01,საერთაშორისო სტანდარტების შესაბამისი პატიმრობისა და თავისუფლების აღკვეთის აღსრულების სისტემის ჩამოყალიბება,Program,Establishment Of Detention And Penitentiary System With International Standards
27 02 02,სრულყოფილი პრობაციის სისტემა,SpendingAgency,Comprehensive Probation System
27 02 02,პრობაციის სრულყოფილი სისტემის ჩამოყალიბება,Program,Establishment Of Comprehensive Probation System
27 02 03,უფასო იურიდიული დახმარება,Program,Free Legal Assistance
27 03,პენიტენციური სისტემისათვის კვალიფიციური კადრების მომზადება,Program,Training Of Qualified Staff For The Penitentiary System
27 03,სასჯელაღსრულებისა და პრობაციის სისტემისათვის თანამშრომელთა მომზადება და პროფესიული განვითარება,Program,Corrections Staff Training And Professional Development
27 03,სასჯელაღსრულებისა და პრობაციის სისტემის თანამშრომელთა მომზადება და პროფესიული განვითარება,Program,Corrections Staff Training And Professional Development
27 04,ჯანმრთელობის დაცვის ხელშეწყობა პატიმრობისა და თავისუფლების აღკვეთის დაწესებულებებში,Program,Stimulation of Healthcare at Penitentiary System Institutions
27 04,ბრალდებულთა და მსჯავრდებულთა უზრუნველყოფა ეკვივალენტური სამედიცინო მომსახურებით,Program,Equivalent Provision Of Medical Services For Accused And Convicted
27 04,ბრალდებულთა და მსჯავრდებულთა ეკვივალენტური სამედიცინო მომსახურებით უზრუნველყოფა,Program,Equivalent Provision Of Medical Services For Accused And Convicted
28 00,საქართველოს საგარეო საქმეთა სამინისტრო,SpendingAgency,Ministry of Foreign Affairs of Georgia
28 01,საგარეო პოლიტიკის განხორციელება,Program,Implementation Of Foreign Policy
28 01 01,საგარეო პოლიტიკის დაგეგმვა და მართვა,Program,Foreign Policy Planning And Management
28 01 01 01,საქართველოს საგარეო საქმეთა სამინისტროს აპარატი,Program,The Office Of The State Minister Of Foreign Affairs
28 01 01 02,საზღვარგარეთ საქართველოს დიპლომატიური დაწესებულებები წარმომადგენლობები,Program,Diplomatic Representations Abroad
28 01 02,საერთაშორისო ორგანიზაციებში არსებული ფინანსური ვალდებულებების უზრუნველყოფა,Program,Financial Liabilities Of Georgia At International Organizations
28 01 03,საერთაშორისო ხელშეკრულებების და სხვა დოკუმენტების თარგმნა და დამოწმება,Program,Translation And Validation Of International Agreements And Other Documents
28 01 03,საერთაშორისო ხელშეკრულებებისა და სხვა დოკუმენტების თარგმნა და დამოწმება,Program,Translation And Validation Of International Agreements And Other Documents
28 02,მოხელეთა კვალიფიკაციის ამაღლება საერთაშორისო ურთიერთობების დარგში,Program,Improvement Of Staff Qualifications In International Relations
29 00,საქართველოს თავდაცვის სამინისტრო,SpendingAgency,Ministry of Defence
29 01,შეიარაღებული ძალების მზადყოფნის შენარჩუნება და ამაღლება,Program,Maintained And Improved Preparedness Of Armed Forces
29 01,შეიარაღებული ძალების საბრძოლო მზადყოფნის შენარჩუნების მხარდაჭერა და შესაძლებლობების განვითარება,Program,Maintained And Improved Preparedness Of Armed Forces And Building of Capacity 
29 02,სამხედრო განათლების განვითარება,Program,Development Of Military Education
29 02,სამხედრო წვრთნა და განათლება,Program,Military Training And Education
29 03,საქართველოს თავდაცვის სამინისტროს პერსონალის ჯანმრთელობის დაცვა და სოციალური უზრუნველყოფა,Program,Healthcare and Social Security of Employees of the Ministry of Defense of Georgia
29 03,სოციალური და სამედიცინო უზრუნველყოფა,Program,Social And Medical Security
29 04,თავდაცვის სფეროში სამეცნიერო კვლევების ხელშეწყობა,Program,Stimulation Of Scientific Research In Defense
29 04,თავდაცის სფეროში სამეცნიერო კვლევების ხელშეწყობა,Program,Stimulation Of Scientific Research In Defense
29 04,"მართვის, კონტროლის, კავშირგაბმულობის და კომპიუტერული სისტემები",Program,"Command, Control, Communication And Computer Systems"
29 05,კიბერუსაფრთხოების უზრუნველყოფა,Program,Ensuring Cyber Security
29 05,ინფრასტრუქტურის განვითარება,Program,Infrastructure Development
29 06,ვეტერანთა მხარდაჭერა,Program,Veterans Support
29 06,საქართველოს შეიარაღებული ძალების შესაძლებლობის გაძლიერება (SG),Program,Strengthening The Capacity Of The Armed Forces (SG)
29 06,საერთაშორისო თანამშრომლობა,Program,International Cooperation
29 07,სამეცნიერო კვლევების ხელშეწყობა,Program,Support Of Science Research
30 00,საქართველოს შინაგან საქმეთა სამინისტრო,SpendingAgency,Ministry of Internal Affairs
30 01,საზოგადოებრივი წესრიგისა და სახელმწიფო საზღვრის დაცვა,Program,Public Order And Sovereign Border Protection
30 01,"საზოგადოებრივი წესრიგი, სახელმწიფო საზღვრის დაცვა და საერთაშორისო თანამშრომლობის განვითარება/გაღრმავება",Program,"Public Order, Sovereign Border Protection And The Development / Enhancement Of The International Cooperation"
30 01,საზოგადოებრივი წესრიგი სახელმწიფო საზღვრის დაცვა და საერთაშორისო თანამშრომლობის განვითარება გაღრმავება,Program,"Public Order, Sovereign Border Protection And The Development / Enhancement Of The International Cooperation"
30 02,"ეროვნული საგანძურის, დიპლომატიური წარმომადგენლობებისა და საპატრიარქოს დაცვის უსაფრთხოების დონის ამაღლება",Program,"Improved Security Of National Treasure, Diplomatic Corps And Patriarchate"
30 02,ეროვნული საგანძურისა და დიპლომატიური წარმომადგენლობების დაცვის უსაფრთხოების დონის ამაღლება,Program,Improved Security Of National Treasure And Diplomatic Corps
30 03,სამართალდამცავი სტრუქტურებისათვის მაღალკვალიფიციური კადრების მომზადება გადამზადება და სასწავლო პროცესის ხელშეწყობა,Program,Training And Retraining Of Highly Qualified Staff For Law Enforcement Bodies And Stimulation Of Education Process
30 03,სამართალდამცავი სტრუქტურებისათვის მაღალკვალიფიციური კადრების მომზადება-გადამზადება და სასწავლო პროცესის ხელშეწყობა,Program,Training And Retraining Of Highly Qualified Staff For Law Enforcement Bodies And Stimulation Of Education Process
30 03,სამართალდამცავი სტრუქტურებისათვის მაღალკვალიფიციური კადრების მომზადება გადამზადება საარქივო ფონდების დიგიტალიზაცია სამეცნიერო კვლევითი საქმიანობა და მოქალაქეთა მომსახურება,Program,"Training And Retraining Of Highly Qualified Staff For Law Enforcement Bodies, Digitalization Of Archival Funds, Scientific Research And Citizen Services"
30 03,"სამართალდამცავი სტრუქტურებისათვის მაღალკვალიფიციური კადრების მომზადება, გადამზადება, საარქივო ფონდების დიგიტალიზაცია, სამეცნიერო-კვლევითი საქმიანობა და მოქალაქეთა მომსახურება",Program,"Training And Retraining Of Highly Qualified Staff For Law Enforcement Bodies, Digitalization Of Archival Funds, Scientific Research And Citizen Services"
30 03,სამართალდამცავი სტრუქტურებისათვის მაღალკვალიციფიური კადრების მომზადება-გადამზადება და სასწავლო პროცესის ხელშეწყობა,Program,Training And Retraining Of Highly Qualified Staff For Law Enforcement Bodies And Stimulation Of Education Process
30 03,"სამართალდამცავი სრუქტურებისათვის მაღალკვალიფიციური კადრების მომზადება, გადამზადება, საარქივო ფონდების დიგიტალიზაცია, სამეცნიერო - კვლევითი საქმიანობა და მოქალაქეთა მომსახურება",Program,"Training And Retraining Of Highly Qualified Staff For Law Enforcement Bodies, Digitalization Of Archival Funds, Scientific Research And Citizen Services"
30 04,შინაგან საქმეთა სამინისტროს სისტემის მოსამსახურეთა ჯანმრთელობის დაცვის მომსახურებით უზრუნველყოფა,Program,Provision of Healthcare Services to the System of the Ministry of Interior
30 04,შინაგან საქმეთა სამინისტროს სისიტემის მოსამსახურეთა ჯანმრთელობის დაცვის მომსახურებით უზრუნველყოფა,Program,Provision of Healthcare Services to the System of the Ministry of Interior
30 04,შინაგან საქმეთა სამინისტროს სისტემის მოსამსახურეთა ჯანმრთელობის დაცვის მომსახურეობით უზრუნველყოფა,Program,Provision of Healthcare Services to the System of the Ministry of Interior
30 04,საქართველოს შინაგან საქმეთა სამინისტროს სისტემის მოსამსახურეთა ჯანმრთელობის დაცვის მომსახურეობით უზრუნველყოფა,Program,Provision of Healthcare Services to the System of the Ministry of Interior Of Georgia
