Budget Item Code,Georgian Name,Budget Item Type,English Translation
33 05,კულტურის სფეროს მდგრადობის უზრუნველყოფისა და ფინანსური ძლიერების პროგრამა,Program,Financial Empowerment And Stability Program For Culture Field
33 05 01,კულტურის სფეროს ფინანსური გაძლიერების პროგრამა,Program,Financial Empowerment Program Of Culture Field
33 05 02,კულტურის სფეროს მდგრადობის უზრუნველყოფის საინვესტიციო ფონდი,Program,Investment Fund For Sustainability of Culture Field
34 00,საქართველოს ოკუპირებული ტერიტორიებიდან იძულებით გადაადგილებულ პირთა განსახლებისა და ლტოლვილთა სამინისტრო,SpendingAgency,"Ministry OF Internally Displaced Persons From The Occupied Territories, Accommodation And Refugees Of Georgia"
34 00,"საქართველოს ოკუპირებული ტერიტორიებიდან იძულებით  გადაადგილებულ პირთა, განსახლებისა და ლტოლვილთა სამინისტრო",SpendingAgency,"Ministry of Internally Displaced Persons from the Occupied Territories, Accommodation and Refugees of Georgia"
34 00,"საქართველოს ოკუპირებული ტერიტორიებიდან იძულებით გადაადგილებულ პირთა, განსახლებისა და ლტოლვილთა სამინისტრო",SpendingAgency,"Ministry Of Internally Displaced Persons From The Occupied Territories, Accommodation And Refugees Of Georgia"
34 00,"საქართველოს ოკუპირებული ტერიტორიებიდან იძულებით გადაადგილებულ პირთა, განსახლებისა და ლტოლვილთა სამინისტრო",SpendingAgency,"Ministry Of Internally Displaced Persons From The Occupied Territories, Accommodation And Refugees Of Georgia"
34 01,იძულებით გადაადგილებულ პირთა და მიგრანტთა ხელშეწყობის მიზნით სახელმწიფო პოლიტიკის შემუშავება და პროგრამების მართვა,Program,State Policy Making And Program Management To Facilitate IDPs And Migrants
34 02,ორგანიზებულად ჩასახლების ადგილებში დევნილთა შენახვა და მათი საცხოვრებელი პირობების გაუმჯობესება,Program,Financial Support Of Refugees Settled In An Organized Manner And Improvement Of Their Living Standards
34 02,განსახლების ადგილებში დევნილთა შენახვა და მათი საცხოვრებელი პირობების გაუმჯობესება,Program,Financial Support Of Refugees Settled In Resettlement Areas And Improvement Of Their Living Standards
34 03,დევნილთა საარსებო წყაროებით უზრუნველყოფა,Program,Securing Refugees With Livelihoods
35 00,საქართველოს შრომის ჯანმრთელობისა და სოციალური დაცვის სამინისტრო,SpendingAgency,Ministry Of Labour Health and Social Affairs Georgia
35 00,"საქართველოს შრომის, ჯანმრთელობისა და სოციალური დაცვის სამინისტრო",SpendingAgency,Ministry Of Labour Health and Social Affairs Georgia
35 01,შრომის ჯანმრთელობისა და სოციალური დაცვის პროგრამების მართვა,Program,"Labor, Health and Social Security Program Management"
35 01,"შრომის, ჯანმრთელობისა და სოციალური დაცვის პროგრამების მართვა",Program,"Labor, Health and Social Security Program Management"
35 01 01,შრომის ჯანმრთელობისა და სოციალური დაცვის სფეროში პოლიტიკის შემუშავება და მართვა,Program,"Policy-Making And Management In The Areas Of Labor, Healthcare And Social Security"
35 01 01,"შრომის, ჯანმრთელობისა და სოციალური დაცვის სფეროში პოლიტიკის შემუშავება და მართვა",Program,"Policy-Making And Management In The Areas Of Labor, Healthcare And Social Security"
35 01 02,სამედიცინო საქმიანობის რეგულირების პროგრამა,Program,Program For Regulation Of Medical Operation
35 01 03,დაავადებათა კონტროლისა და ეპიდემიოლოგიური უსაფრთხოების პროგრამის მართვა,Program,Management of Program For Disease Control And Epidemic Safety
35 01 04,სოციალური და ჯანმრთელობის დაცვის პროგრამების მართვა,Program,Social And Healthcare Program Management
35 01 05,სახელმწიფო ზრუნვის პროგრამა,Program,Program of State Care
35 01 05,"სახელმწიფო ზრუნვის, ადამიანით ვაჭრობის (ტრეფიკინგის) მსხვერპლთა დაცვა და დახმარების პროგრამა",Program,"State Care, Human Trafficking And The Protection Of Victims Assistance Program"
35 01 05,სახელმწიფო ზრუნვის ადამიანით ვაჭრობის ტრეფიკინგის მსხვერპლთა დაცვა და დახმარების პროგრამა,Program,"State Care, Human Trafficking And The Protection Of Victims Assistance Program"
35 01 05,"სახელმწიფო ზრუნვის, ადამიანით ვაჭრობის (ტრეფიკინგის) მსხვერპლთა დაცვისა და დახმარების პროგრამა",Program,"State Care, Human Trafficking And The Protection Of Victims Assistance Program"
35 01 06,ადამიანით ვაჭრობის ტრეფიკინგის მსხვერპლთა დაცვა და დახმარება,Program,Protection And Support Of Victims Of Human Trafficking
35 01 06,სასწრაფო სამედიცინო დახმარების მართვის პროგრამა,Program,Medical Emergency Management Program
35 01 06,სასწრაფო სამედიცინო დახმარების მართვის პროგრამა,Program,Medical Emergency Management Program
35 01 06,ადამიანით ვაჭრობის (ტრეფიკინგის) მსხვერპლთა დაცვა და დახმარება,Program,Protection And Support Of Victims Of Human Trafficking
35 01 06,სამედიცინო მედიაციის პროგრამა,Program,Medical Mediation Program
35 01 07,ნარკომანიისა და ფსიქიკური ჯანმრთელობის პოლიტიკისა და პროგრამების მართვის პროგრამა,Program,Management Program Of Drug Addiction And Mental Health Policies And Programs
35 01 07,ნარკომანიით დაავადებულ პირთა რეაბილიტაციის ხელშეწყობის პროგრამა,Program,Support Program For The Rehabilitation Of Drug Addicts
35 01 08,სასწრაფო სამედიცინო დახმარების პროგრამა,Program,Medical Emergency Management Program
35 01 12,ნარკომანიით დაავადებულ პირთა რეაბილიტაციის ხელშეწყობის პროგრამის მართვა,Program,Management Of The Rehabilitation of Drug Addicts Promotion Program
35 02,სოციალური დაცვა და საპენსიო უზრუნველყოფა,Program,Social Security and Pensions
35 02,მოსახლეობის სოციალური დაცვა,Program,Social Security Of Civilians
35 02 01,მოსახლეობის საპენსიო უზრუნველყოფა,Program,Payment Of Pensions
35 02 01,საპენსიო უზრუნველყოფა,Program,Payment of Pensions
35 02 02,სოციალური დახმარებები,Program,Social Security
35 02 02,მოსახლეობის მიზნობრივი ჯგუფების სოციალური დახმარება,Program,Social Assistance Of Targeted Groups Of Population
35 02 03,სოციალური რეაბილიტაცია და ბავშვზე ზრუნვა,Program,Social Rehabilitation And Child Care
35 02 05,მოსახლეობის ელექტროენერგიის ვაუჩერით უზრუნველყოფა,Program,Provide People With Electric Power Voucher
35 02 05,სამუშაოს მაძიებელთა აღრიცხვისა და საქართველოს ოკუპირებული ტერიტორიებიდან იძულებით გადაადგილებულ პირთა − დევნილთა საჭიროებების შეფასების პროგრამა,Program,Needs Assessment Program For Job seekers and Internally Displaced Persons
35 03,ჯანმრთელობის დაცვის პროგრამა,Program,Healthcare Program
35 03,მოსახლეობის ჯანმრთელობის დაცვა,Program,Public Healthcare Program
35 03 01,ჯანმრთელობის დაზღვევა,Program,Health Insurance
35 03 02,საზოგადოებრივი ჯანმრთელობის დაცვა,Program,Public Healthcare
35 03 02,მოსახლეობის საყოველთაო ჯანმრთელობის დაცვა,Program,The Universal Health Care
35 03 02,საზოგადოებრივი ჯანმრთელობის დაცვა,Program,Public Healthcare
35 03 02 01,დაავადებათა ადრეული გამოვლენა და სკრინინგი,Program,Early Identification And Screening Of Diseases
35 03 02 01,დაავადებათა ადრეული გამოვლენა და სკრინინგი,Program,Early Identification And Screening Of Diseases
35 03 02 02,იმუნიზაცია,Program,Immunization
35 03 02 02,იმუნიზაცია,Program,Immunization
35 03 02 03,ეპიდზედამხედველობის პროგრამა,Program,Epidemic Surveillance Program
35 03 02 03,ეპიდზედამხედველობა,Program,Epidemic Surveillance
35 03 02 03,ეპიდზედამხედველობის პროგრამა,Program,Epidemic Surveillance Program
35 03 02 04,უსაფრთხო სისხლი,Program,Safe Blood
35 03 02 04,უსაფრთხო სისხლი,Program,Safe Blood
35 03 02 05,პროფესიულ დაავადებათა პრევენცია,Program,Professional Disease Prevention
35 03 02 05,პროფესიულ დაავადებათა პრევენცია,Program,Professional Disease Prevention
35 03 02 06,პირველადი ჯანდაცვის რეფორმის მხარდაჭერის პროექტი (EC),Program,Primary Healthcare Perform Project (EC)
35 03 02 06,ინფექციური დაავადებების მართვა,Program,Management Of Infectious Diseases
35 03 02 07,ჯანდაცვის სექტორის განვითარების პროექტი (WB),Program,Healthcare Sector Development Project (WB)
35 03 02 07,ტუბერკულოზის მართვა,Program,Management of Tuberculosis
35 03 02 08,აივ ინფექცია/შიდსის მართვა,Program,HIV / AIDS control
35 03 02 08,აივ ინფექცია შიდსი,Program,HIV / AIDS
35 03 02 10,ნარკომანიით დაავადებულ პაციენტთა მკურნალობა,Program,Treatment of Drug-addicted patients
35 03 02 11,ჯანმრთელობის ხელშეწყობა,Program,Health Promotion
35 03 02 11,ჯანმრთელობის ხელშეწყობის პროგრამა,Program,Health Promotion Program
35 03 02 12,C ჰეპატიტის მართვა,Program,Management of C Hepatitis
35 03 03,მოსახლეობისათვის სამედიცინო მომსახურების მიწოდება პრიორიტეტულ სფეროებში,Program,Provision Of Healthcare Services To General Public In Priority Areas
35 03 03,მოსახლეობისათვის სამედიცინო მომსახურების მიწოდება პრიორიტეტულ სფეროებში,Program,Provision Of Healthcare Services To General Public In Priority Areas
35 03 03,მოსახლეობისათვის სამედიცინო მომსახურების მიწოდება პრიორიტეტულ სფეროებში,Program,Provision Of Healthcare Services To General Public In Priority Areas
35 03 03 01,ფსიქიკური ჯანმრთელობა,Program,Psychic Healthcare
35 03 03 01,ფსიქიკური ჯანმრთელობა,Program,Psychic Healthcare
35 03 03 05,დედათა და ბავშვთა ჯანმრთელობა,Program,Healthcare Of Mothers And Children
35 03 03 06,დიაბეტის მართვა,Program,Diabetes Management
35 03 03 06 02,ინფექციური დაავადებების მართვა საქართველოს შრომის ჯანმრთელობისა და სოციალური დაცვის სამინისტროს ცენტრალური აპარატი,Program,"Management Of Infectious Diseases Central Office Of  Labour, Health and Social Affairs Ministry"
35 03 03 07,ნარკომანია,Program,Drug Addiction
35 03 03 07,ნარკომანია,Program,Drug Addiction
35 03 03 07,"სასწრაფო, გადაუდებელი დახმარება და სამედიცინო ტრანსპორტირება",Program,"Urgent, Emergency Assistance and Medical Transportation"
35 03 03 08,ონკოლოგიურ დაავადებათა მართვა,Program,Cancer Disease Management
35 03 03 08,აივ ინფექცია/შიდსი,Program,HIV / AIDS
35 03 03 09,დედათა და ბავშვთა ჯანმრთელობა,Program,Healthcare Of Mothers And Children
35 03 03 09,რეფერალური მომსახურება,Program,Referral Services
35 03 03 10,ნარკომანია,Program,Drug Addiction
35 03 03 10,გულის ქირურგია,Program,Heart Surgery
35 03 03 11,ინკურაბელურ პაციენტთა პალიატიური მზრუნველობა,Program,Paliatic Care Of Incurable Patients
35 03 03 11,პირველადი ჯანდაცვის რეფორმის მხარდაჭერის პროექტი (ევროკავშირი),Program,Primary Healthcare Perform Project (European Union)
35 03 03 12,იშვიათი დაავადებების მქონე და მუდმივ ჩანაცვლებით მკურნალობას დაქვემდებარებულ პაციენტთა მკურნალობა,Program,Treatment Of Patients With Rare Diseases On Permanent Substitution Care
35 03 03 12,ჯანდაცვის სექტორის განვითარების პროექტი (მსოფლიო ბანკი),Program,Healthcare Sector Development Project (WB)
35 03 03 13,ყველა ფორმის ტუბერკულოზის ხარისხიან დიაგნოსტიკასა და მკურნალობაზე უნივერსალური ხელმისაწვდომობის პროგრამა,Program,Universal Access To Quality Diagnosis And Treatment Of All Forms Of Tuberculosis Program
35 03 03 14,სოფლის ექიმი,Program,Village Doctor
35 03 03 14,"საქართველოში აივ ინფექცია/შიდსის პრევენციის მიზნით არსებული ეროვნული რეაგირების მხარდაჭერა, აივ ინფექცია/შიდსით დაავადებულთა სიცოცხლის მაჩვენებლების გაუმჯობესება მკურნალობისა და მოვლის ღონისძიებების გაძლიერების გზით",Program,"National Response Support For HIV / AIDS Prevention In Georgia, HIV / AIDS treatment And Care Measures Strengthening  To Increase Life Index"
35 03 03 16,ანტირაბიული დახმარება,Program,Antirabial Service 
35 03 03 17,წლამდე ასაკის ბავშვთა გადაუდებელი და სტაციონარული დახმარება,Program,Urgent And Inpatient Care Of Children Below 3
35 03 03 17,3 წლამდე ასაკის ბავშვთა გადაუდებელი და სტაციონარული დახმარება,Program,Urgent And Inpatient Care Of Children Below 3
35 03 03 18,ურგენტული მომსახურება,Program,Urgent Care
35 03 03 19,ზოგადი ამბულატორია,Program,General Out-Patient Care
35 03 03 20,ვეტერანთა სამედიცინო მომსახურება,Program,Veteran Services
35 03 04,მოსახლეობისათვის სამედიცინო მომსახურების მიწოდება პრიორიტეტულ სფეროებში,Program,Public Health Service Delivery In The Priority Areas
35 03 04,დიპლომისშემდგომი სამედიცინო განათლება,Program,Post Graduate Health Education
35 03 04 01,ფსიქიკური ჯანმრთელობა,Program,Mental Health
35 03 04 02,დიაბეტის მართვა,Program,Management Of Diabetes
35 03 04 03,ბავშვთა ონკოჰემატოლოგიური მომსახურება,Program,Children Hematological Services
35 03 04 03,ბავშვთა ონკოჰემატოლოგიური მომსახურება,Program,Children Hematological Services
35 03 04 04,დიალიზი და თირკმლის ტრანსპლანტაცია,Program,Dialysis and Kidney Transplantation
35 03 04 04,დიალიზი და თირკმლის ტრანსპლანტაცია,Program,Dialysis and Kidney Transplantation
35 03 04 05,ინკურაბელურ პაციენტთა პალიატიური მზრუნველობა,Program,Palliative care for incurable patients
35 03 04 06,იშვიათი დაავადებების მქონე და მუდმივ ჩანაცვლებით მკურნალობას დაქვემდებარებულ პაციენტთა მკურნალობა,Program,Treatment Of Patients With Rare Diseases On Permanent Substitution Care
35 03 04 07,სასწრაფო გადაუდებელი დახმარება და სამედიცინო ტრანსპორტირება,Program,Emergency Assistance and Medical Transportation
35 03 04 07,სასწრაფო გადაუდებელი დახმარება და სამედიცინო ტრანსპორტირება,Program,Emergency Assistance and Medical Transportation
35 03 04 08,სოფლის ექიმი,Program,Village Doctors
35 03 04 09,რეფერალური მომსახურება,Program,Referral Services
35 03 04 10,სამხედრო ძალებში გასაწვევ მოქალაქეთა სამედიცინო შემოწმება,Program,Medical Examination For Recruiting People In Military Forces
35 03 04 10,სამხედრო ძალებში გასაწვევ მოქალაქეთა სამედიცინო შემოწმება,Program,Medical Examination For Recruiting People In Military Forces
35 03 05,დიპლომისშემდგომი სამედიცინო განათლება,Program,Post Graduate Health Education
35 03 05,პროგრამების შესაძლო დეფიციტის დაფინანსება,Program,Potential Deficit Program Funding
35 03 06,"სამედიცინო მომსახურების შეუფერხებელი მიწოდების მიზნით, სამედიცინო დაწესებულებების ფინანსური ხელშეწყობის ღონისძიებები",Program,Financial Support Measures Of Medical Institutions For Unhindered Delivery Of Health Services
35 03 06,სამედიცინო მომსახურების შეუფერხებელი მიწოდების მიზნით სამედიცინო დაწესებულებების ფინანსური ხელშეწყობის ღონისძიებები,Program,Financial Support Measures Of Medical Institutions For Unhindered Delivery Of Health Services
35 03 07,ტუბერკულოზთან ბრძოლის რეგიონალური პროგრამა (II ფაზა) (KfW),Program,Regional Tuberculosis Program (II phase) (KfW)
35 04,სამედიცინო დაწესებულებათა რეაბილიტაცია და აღჭურვა,Program,Rehabilitation and Provision of Equipment of Health Facilities
35 05,შრომისა და დასაქმების სისტემის რეფორმების პროგრამა,Program,Labor and employment system reform program
35 05,შრომის პირობების მონიტორინგის პროგრამა,Program,Monitoring Program Of Working Conditions
35 05 01,შრომისა და დასაქმების სისტემის რეფორმების პროგრამა,Program,Reform Program For The Labor and Employment System
35 06,სამუშაოს მაძიებელთა პროფესიული მომზადება-გადამზადების პროგრამა,Program,Vocational Training Program for Job Seekers
35 06,სამუშაოს მაძიებელთა პროფესიული მომზადება გადამზადების პროგრამა,Program,Vocational Training Program for Job Seekers
